Ссылка;Название;Сайт;Телефон;Email;Рубрики
"https://icatalog.expocentr.ru/ru/exhibitions/190a3ab4-1050-11f0-80ce-a0d3c1fab97f/exhibitors/381061?&stand=2C060";"WEST GLOBAL MAKINA TIC. A.S.";"http://westmakina.com.tr/";"+90 5425407852";"furkang@westmakina.com.tr";"Сушильно-ширильные машины Красильные машины и аппараты"
"https://icatalog.expocentr.ru/ru/exhibitions/190a3ab4-1050-11f0-80ce-a0d3c1fab97f/exhibitors/381456?&stand=2A070";"WUHU ARIS INTERNATIONAL TRADE CO. LTD";"http://www.aris-textile.com/";"+86-17755308650";"osben@aris-textile.com";"Основовязальные машины"
"https://icatalog.expocentr.ru/ru/exhibitions/190a3ab4-1050-11f0-80ce-a0d3c1fab97f/exhibitors/381457?&stand=2B070";"WUXI XIANHE AUTOMATION EQUIPMENT CO. LTD";"ОШИБКА";"ОШИБКА";"ОШИБКА";""
"https://icatalog.expocentr.ru/ru/exhibitions/190a3ab4-1050-11f0-80ce-a0d3c1fab97f/exhibitors/381483?&stand=2C043";"XIAMEN YITAI INDUSTRIAL CO. LTD";"http://yeetex.com/";"+86 05922102277";"sales560@yeetex.com";"Крутильные машины Лентоткацкие станки Бесчелночные ткацкие станки Жаккардовые машины Плетельные машины"
"https://icatalog.expocentr.ru/ru/exhibitions/190a3ab4-1050-11f0-80ce-a0d3c1fab97f/exhibitors/381063?&stand=2E020";"ZHEJIANG DOLLOR SEWING MACHINE CO. LTD";"http://www.dollor.biz/";"+86 578-2197193";"geranka@mail.ru";"Швейные машины Промышленные швейные машины Оверлоки Оборудование для производства обуви и кожгалантерейных изделий"
"https://icatalog.expocentr.ru/ru/exhibitions/190a3ab4-1050-11f0-80ce-a0d3c1fab97f/exhibitors/381461?&stand=2B078";"ZHEJIANG JOYA POLYMER TECHNOLOGY CO. LTD";"http://www.joyachem.com/";"+86-573-88689281";"info@joyachem.com";"Вспомогательное оборудование и устройства для отделочного текстильного производства"
"https://icatalog.expocentr.ru/ru/exhibitions/190a3ab4-1050-11f0-80ce-a0d3c1fab97f/exhibitors/381459?&stand=2B074";"ZHEJIANG KAICHENG INTELLIGENT MACHINERY CO. LTD";"http://www.chinakaicheng.com/";"+86 18888717551";"Sales02@chinakaicheng.com";"Крутильные машины Мотальные машины, машины для намотки пряжи в мотки"
"https://icatalog.expocentr.ru/ru/exhibitions/190a3ab4-1050-11f0-80ce-a0d3c1fab97f/exhibitors/381059?&stand=2D120";"ZHONGXIN TM";"http://xn----7sbgb3a8abhy8d.xn--p1ai/";"+7 (499) 559-9968";"sailid-manager@yandex.ru";"Швейные машины Промышленные швейные машины Подготовительное оборудование для швейного производства, швейные автоматы, машины, устройства и принадлежности Новые технологии и новые материалы для легкой и текстильной промышленности"
"https://icatalog.expocentr.ru/ru/exhibitions/190a3ab4-1050-11f0-80ce-a0d3c1fab97f/exhibitors/381048?&stand=2B025";"АЗБУКА ВЯЗАНИЯ";"http://www.az-v.ru/";"+7 383 310-7235";"dir@az-v.ru";"Шнуровязальные машины Оборудование упаковочно-маркировочное Оборудование для канатного производства Перемоточные машины Мотальные машины, машины для намотки пряжи в мотки Лентоткацкие станки"
"https://icatalog.expocentr.ru/ru/exhibitions/190a3ab4-1050-11f0-80ce-a0d3c1fab97f/exhibitors/381048?&stand=2C043";"АЗБУКА ВЯЗАНИЯ";"http://www.az-v.ru/";"+7 383 310-7235";"dir@az-v.ru";"Шнуровязальные машины Оборудование упаковочно-маркировочное Оборудование для канатного производства Перемоточные машины Мотальные машины, машины для намотки пряжи в мотки Лентоткацкие станки"
"https://icatalog.expocentr.ru/ru/exhibitions/190a3ab4-1050-11f0-80ce-a0d3c1fab97f/exhibitors/381582?&stand=2A050";"АЛЬФА-БАНК";"https://www.inlegmash-expo.ru/";"";"";""
"https://icatalog.expocentr.ru/ru/exhibitions/190a3ab4-1050-11f0-80ce-a0d3c1fab97f/exhibitors/381028?&stand=2B030";"БАГТЕКС";"http://www.bagtex.ru/";"+7 (926) 640-6438";"ab@bagtex.ru";"Оборудование упаковочно-маркировочное Перемоточные машины Подготовительное оборудование для ткацкого производства Бесчелночные ткацкие станки Сушильно-ширильные машины Красильные машины и аппараты Оборудование для печати по текстилю"
"https://icatalog.expocentr.ru/ru/exhibitions/190a3ab4-1050-11f0-80ce-a0d3c1fab97f/exhibitors/381583?&stand=2B050";"БЫКОВ ИВАН ИВАНОВИЧ, ИП";"https://www.inlegmash-expo.ru/";"";"";""
"https://icatalog.expocentr.ru/ru/exhibitions/190a3ab4-1050-11f0-80ce-a0d3c1fab97f/exhibitors/381013?&stand=2D110";"ВЕЛЛЕС, группа компаний";"http://www.velles.ru/";"+7 (495) 665-0556";"sm@velles.ru";"Плосковязальные машины Швейные машины Вышивальные машины Раскройные установки (комплексы), машины и устройства, принадлежности Принтеры, плоттеры Термопрессы, каландры"
"https://icatalog.expocentr.ru/ru/exhibitions/190a3ab4-1050-11f0-80ce-a0d3c1fab97f/exhibitors/381065?&stand=2C110";"ВЕЛЛТЕКС, ООО";"http://www.welltex.ru/";"+7 (495) 626-8400";"info@welltex.ru";"Швейные машины Вышивальные машины Оборудование для влажно-тепловой обработки (ВТО) Системы и средства автоматического контроля и управления технологическим оборудованием Ткани Текстильная галантерея и фурнитура"
"https://icatalog.expocentr.ru/ru/exhibitions/190a3ab4-1050-11f0-80ce-a0d3c1fab97f/exhibitors/381062?&stand=2E020";"ГЕРАН ЛЮКС, ООО";"http://www.geran.ru/";"+7 (495) 949-5510";"geranka@mail.ru";"Швейные машины Промышленные швейные машины Оборудование для влажно-тепловой обработки (ВТО) Оборудование для производства обуви и кожгалантерейных изделий Запчасти, комплектующие и техоснастка Сервисное обслуживание оборудования"
"https://icatalog.expocentr.ru/ru/exhibitions/190a3ab4-1050-11f0-80ce-a0d3c1fab97f/exhibitors/381041?&stand=2D098";"ГРАМОС, ООО";"http://www.granucci.ru/";"+7 (495) 767-1533";"info@granucci.ru";"Швейные машины Подготовительное оборудование для швейного производства, швейные автоматы, машины, устройства и принадлежности Раскройные установки (комплексы), машины и устройства, принадлежности Оборудование для производства обуви и кожгалантерейных изделий Запчасти, комплектующие и техоснастка Сервисное обслуживание оборудования"
"https://icatalog.expocentr.ru/ru/exhibitions/190a3ab4-1050-11f0-80ce-a0d3c1fab97f/exhibitors/381584?&stand=2E081";"ГРАНД ДЕЙ";"https://www.inlegmash-expo.ru/";"";"";""
"https://icatalog.expocentr.ru/ru/exhibitions/190a3ab4-1050-11f0-80ce-a0d3c1fab97f/exhibitors/381034?&stand=2E045";"ДАП РУ, ООО";"http://das-russia.ru/";"+7 (495) 674-0061";"shekhanova@dap-russia.ru";"Швейные машины Промышленные швейные машины Подготовительное оборудование для швейного производства, швейные автоматы, машины, устройства и принадлежности Оборудование для производства обуви и кожгалантерейных изделий Запчасти, комплектующие и техоснастка Новые технологии и новые материалы для легкой и текстильной промышленности"
"https://icatalog.expocentr.ru/ru/exhibitions/190a3ab4-1050-11f0-80ce-a0d3c1fab97f/exhibitors/381043?&stand=2D100";"ЗИПКИТ ТЕХНОЛОДЖИ, ООО";"https://zipkit-technology.ru/";"+7 (953) 327-3740";"100@zipkittech.ru";"Раскройные установки (комплексы), машины и устройства, принадлежности Оборудование для производства обуви и кожгалантерейных изделий Оборудование для мехового и кожевенного производства"
"https://icatalog.expocentr.ru/ru/exhibitions/190a3ab4-1050-11f0-80ce-a0d3c1fab97f/exhibitors/381039?&stand=2F034";"ИМПОРТМАШ";"https://importmash.com/";"+7 (920) 374-2050";"gusmanov@importmash.com";"Вышивальные машины Оборудование для настила ткани Запчасти, комплектующие и техоснастка Оборудование для переработки химических волокон Мерильно-браковочное оборудование Оборудование для производства технического текстиля"
"https://icatalog.expocentr.ru/ru/exhibitions/190a3ab4-1050-11f0-80ce-a0d3c1fab97f/exhibitors/381016?&stand=2D087";"ИННТЕРИ, ООО";"http://dlican.ru/";"+7 (495) 324-5575";"info@dlican.ru";"Сопутствующие товары и услуги Оборудование для печати по текстилю Принтеры, плоттеры Принтеры для печати по футболкам Красители и химикаты для легкой промышленности"
"https://icatalog.expocentr.ru/ru/exhibitions/190a3ab4-1050-11f0-80ce-a0d3c1fab97f/exhibitors/381032?&stand=2E042";"КОМТЕНС ТРЕЙДИНГ, ООО";"https://comtense.ru/";"+7 (495) 232-9394";"mail11@comtense.ru";"Раскройные установки (комплексы), машины и устройства, принадлежности Оборудование для настила ткани Вспомогательное оборудование, детали и материалы Системы компьютерного проектирования CAD/CAM для текстильной промышленности"
"https://icatalog.expocentr.ru/ru/exhibitions/190a3ab4-1050-11f0-80ce-a0d3c1fab97f/exhibitors/381051?&stand=2A015";"КУРЬЕР. ЛЕГКАЯ ПРОМЫШЛЕННОСТЬ, ИНФОРМАЦИОННО-РЕКЛАМНЫЙ ЖУРНАЛ";"http://lp-magazine.ru/";"+7 (812) 275-8526";"lp@lp-magazine.ru";"СМИ"
"https://icatalog.expocentr.ru/ru/exhibitions/190a3ab4-1050-11f0-80ce-a0d3c1fab97f/exhibitors/381454?&stand=2C042";"ЛИНАР-М";"http://linarm.ru/";"+7 (495) 649-0628";"7969092@mail.ru";"Оборудование для переработки химических волокон Лентоткацкие станки Бесчелночные ткацкие станки Жаккардовые машины Оборудование для производства нетканых материалов Оборудование для производства технического текстиля"
"https://icatalog.expocentr.ru/ru/exhibitions/190a3ab4-1050-11f0-80ce-a0d3c1fab97f/exhibitors/381025?&stand=2C075";"ЛРТ, ООО";"http://www.lrt.ru/";"+7 (495) 730-5118";"info@lrt.ru";"Раскройные установки (комплексы), машины и устройства, принадлежности Оборудование для настила ткани Оборудование для печати по текстилю Принтеры, плоттеры Термопрессы, каландры"
"https://icatalog.expocentr.ru/ru/exhibitions/190a3ab4-1050-11f0-80ce-a0d3c1fab97f/exhibitors/381056?&stand=2E040";"МАТЕК, ООО";"http://www.matek.su/";"+7 (495) 781-3160";"7813160@mail.ru";"Промышленные швейные машины Подготовительное оборудование для швейного производства, швейные автоматы, машины, устройства и принадлежности Раскройные установки (комплексы), машины и устройства, принадлежности Системы и средства автоматического контроля и управления технологическим оборудованием Запчасти, комплектующие и техоснастка Новые технологии и новые материалы для легкой и текстильной промышленности"
"https://icatalog.expocentr.ru/ru/exhibitions/190a3ab4-1050-11f0-80ce-a0d3c1fab97f/exhibitors/380998?&stand=2A010";"МИРЭКС, АО";"https://www.miomirex.ru/";"+7 (499) 685-1271, (925) 741-1699";"alexey@plitkamirex.ru";"Запчасти, комплектующие и техоснастка Оборудование и технологии для производства технического текстиля Вспомогательное оборудование, детали и материалы Челночные ткацкие станки Бесчелночные ткацкие станки Сушильно-ширильные машины"
"https://icatalog.expocentr.ru/ru/exhibitions/190a3ab4-1050-11f0-80ce-a0d3c1fab97f/exhibitors/380997?&stand=2B001";"МОСПРОМХОЛДИНГ, ООО (КОНВЕРС, ТМ)";"http://www.konvers.ru/";"+7 (499) 322-4528";"info@konvers.ru";"Раскройные установки (комплексы), машины и устройства, принадлежности Оборудование для производства обуви и кожгалантерейных изделий Запчасти, комплектующие и техоснастка Текстильная галантерея и фурнитура Сопутствующие товары и услуги Системы компьютерного проектирования CAD/CAM для текстильной промышленности"
"https://icatalog.expocentr.ru/ru/exhibitions/190a3ab4-1050-11f0-80ce-a0d3c1fab97f/exhibitors/381050?&stand=2B100";"МОСТ ТК, ООО";"http://jiangyin-most.ru/";"+7 (910) 676-0333";"yangfg1973@126.com";"Подготовительное оборудование для ткацкого производства Вспомогательное оборудование для ткацкого производства Зевообразовательные механизмы и вспомогательные машины Бесчелночные ткацкие станки Жаккардовые машины Сушильно-ширильные машины"
"https://icatalog.expocentr.ru/ru/exhibitions/190a3ab4-1050-11f0-80ce-a0d3c1fab97f/exhibitors/381587?&stand=2D070";"МП-ПРОГРЕСС";"https://www.inlegmash-expo.ru/";"";"";""
"https://icatalog.expocentr.ru/ru/exhibitions/190a3ab4-1050-11f0-80ce-a0d3c1fab97f/exhibitors/381026?&stand=2D060";"НИССА ДИСТРИБУЦИЯ, ООО";"http://www.stensart.ru/";"+7 (495) 956-4007";"nissa@nd.nissa.ru";"Раскройные установки (комплексы), машины и устройства, принадлежности Оборудование для печати по текстилю Принтеры, плоттеры Термопрессы, каландры Принтеры для печати по футболкам Комплексы для DTF-печати"
"https://icatalog.expocentr.ru/ru/exhibitions/190a3ab4-1050-11f0-80ce-a0d3c1fab97f/exhibitors/381055?&stand=2C100";"ОРОКС-ГРУП РУС, ООО";"http://mozes-inc.ru/";"+7 (910) 863-0505";"info@mozes-inc.ru";"Раскройные установки (комплексы), машины и устройства, принадлежности"
"https://icatalog.expocentr.ru/ru/exhibitions/190a3ab4-1050-11f0-80ce-a0d3c1fab97f/exhibitors/381481?&stand=2B010";"ПАПИЛЛОНС, ТД";"http://tdppl.ru/";"+7 (495) 933-3756";"msk@tdppl.ru";"Раскройные установки (комплексы), машины и устройства, принадлежности Оборудование для печати по текстилю Принтеры, плоттеры Термопрессы, каландры Комплексы для DTF-печати Красители и химикаты для легкой промышленности"
"https://icatalog.expocentr.ru/ru/exhibitions/190a3ab4-1050-11f0-80ce-a0d3c1fab97f/exhibitors/381000?&stand=2C050";"ПЛЕТМАШ, ООО";"http://pletmash.ru/";"+7 (917) 563-8274";"pletmash@mail.ru";"Крутильные машины Перемоточные машины Тростильные машины Лентоткацкие станки Аппретирующее и отделочное оборудование Плетельные машины"
"https://icatalog.expocentr.ru/ru/exhibitions/190a3ab4-1050-11f0-80ce-a0d3c1fab97f/exhibitors/381580?&stand=2D060";"ПРИЗМИКС, ООО";"http://prizmix.ru/";"+7 (495) 956-1115";"info@prizmix.ru";"Промышленные швейные машины Принтеры, плоттеры Прочие машины для резки текстиля"
"https://icatalog.expocentr.ru/ru/exhibitions/190a3ab4-1050-11f0-80ce-a0d3c1fab97f/exhibitors/381008?&stand=2C080";"ПРИНТЕКС УЕ, ООО";"http://www.printexue.ru/";"+7 495 792 0331";"sales@printexue.ru";"Запчасти, комплектующие и техоснастка Сервисное обслуживание оборудования Вспомогательное оборудование, детали и материалы Оборудование для печати по текстилю Комплексы для DTF-печати"
"https://icatalog.expocentr.ru/ru/exhibitions/190a3ab4-1050-11f0-80ce-a0d3c1fab97f/exhibitors/381485?&stand=2C015";"ПРОМЭКСПЕРТ, ООО";"https://promexpert.ru/";"+7 (4932) 939313";"sales@promexpert.ru";"Швейные машины Вышивальные машины Многоголовочные вышивальные машины Подготовительное оборудование для швейного производства, швейные автоматы, машины, устройства и принадлежности Раскройные установки (комплексы), машины и устройства, принадлежности Гладильные и стабилизирующие установки, машины, устройства и принадлежности"
"https://icatalog.expocentr.ru/ru/exhibitions/190a3ab4-1050-11f0-80ce-a0d3c1fab97f/exhibitors/381480?&stand=2D020";"ПРОФЕССИОНАЛЬНОЕ ШВЕЙНОЕ ОБОРУДОВАНИЕ, ООО";"https://profshvey.ru/";"+7 (495) 145-9599";"info@profshvey.ru";"Швейные машины Вышивальные машины Многоголовочные вышивальные машины Подготовительное оборудование для швейного производства, швейные автоматы, машины, устройства и принадлежности Раскройные установки (комплексы), машины и устройства, принадлежности Гладильные и стабилизирующие установки, машины, устройства и принадлежности Оборудование для производства обуви и кожгалантерейных изделий Запчасти, комплектующие и техоснастка"
"https://icatalog.expocentr.ru/ru/exhibitions/190a3ab4-1050-11f0-80ce-a0d3c1fab97f/exhibitors/381274?&stand=2B040";"САВЧЕНКО ИНЕССА АЛЕКСАНДРОВНА, ИП";"https://www.inlegmash-expo.ru/";"+7 (995) 916-0336";"intorgsnab@yandex.ru";"Запчасти, комплектующие и техоснастка"
"https://icatalog.expocentr.ru/ru/exhibitions/190a3ab4-1050-11f0-80ce-a0d3c1fab97f/exhibitors/381064?&stand=2B008";"СВЕТОЧ, ООО";"http://svetochlaser.ru/";"+7 (920) 135-6140";"svetochlaser@yandex.ru";"Машины для продольной резки Машины для резки синели, машины для опаливания синели Машины для резки образцов с зубчиками по краю Прочие машины для резки текстиля Аппараты горячей резки синтетических тканей"
"https://icatalog.expocentr.ru/ru/exhibitions/190a3ab4-1050-11f0-80ce-a0d3c1fab97f/exhibitors/381053?&stand=2D090";"СИБ СП ПРАЙМ, ООО";"http://www.sib-sp.com/";"+7 (383) 310-1869";"info@sib-sp.com";"Сервисное обслуживание оборудования Вспомогательное оборудование, детали и материалы Оборудование для печати по текстилю Термопрессы, каландры Комплексы для DTF-печати"
"https://icatalog.expocentr.ru/ru/exhibitions/190a3ab4-1050-11f0-80ce-a0d3c1fab97f/exhibitors/380996?&stand=2D040";"СМАРТ-Т, ООО";"http://www.smart-t.ru/";"+7 (495) 663-9111";"dima@smart-t.ru";"Раскройные установки (комплексы), машины и устройства, принадлежности Оборудование для настила ткани Оборудование для печати по текстилю Принтеры, плоттеры Термопрессы, каландры Комплексы для DTF-печати"
"https://icatalog.expocentr.ru/ru/exhibitions/190a3ab4-1050-11f0-80ce-a0d3c1fab97f/exhibitors/381042?&stand=2F010";"СНД, ООО";"http://www.sanddi.ru/";"+7 (812) 327-4713";"sergey@sanddi.com";"Кругловязальные машины Запчасти, комплектующие и техоснастка Прядильные машины Подготовительное оборудование для ткацкого производства Бесчелночные ткацкие станки Аппретирующее и отделочное оборудование Складальное и паковочное оборудование Мерильно-браковочное оборудование"
"https://icatalog.expocentr.ru/ru/exhibitions/190a3ab4-1050-11f0-80ce-a0d3c1fab97f/exhibitors/381585?&stand=2B101";"СОВРЕМЕННЫЕ ТЕХНОЛОГИЧЕСКИЕ ЛИНИИ";"https://www.inlegmash-expo.ru/";"";"";""
"https://icatalog.expocentr.ru/ru/exhibitions/190a3ab4-1050-11f0-80ce-a0d3c1fab97f/exhibitors/381027?&stand=2E030";"СПОРТТЕКС, ООО";"http://www.sporttex.ru/";"+7 (499) 322-0953";"sporttex@mail.ru";"Запчасти, комплектующие и техоснастка Технические ткани Ленты, веревки, шнуры, ремни, канаты, такелаж, сети Термопрессы, каландры Машины для резки образцов с зубчиками по краю Прочие машины для резки текстиля"
"https://icatalog.expocentr.ru/ru/exhibitions/190a3ab4-1050-11f0-80ce-a0d3c1fab97f/exhibitors/381044?&stand=2C012";"ТЕКСИ-77, ООО";"http://texy-77.ru/";"+7 (926) 191-7141";"gelo199@gmail.com";"Подготовительное и вспомогательное оборудование для трикотажного и вязального производства Охрана окружающей среды Сушильно-ширильные машины Красильные машины и аппараты Термопрессы, каландры Аппретирующее и отделочное оборудование Вспомогательное оборудование и устройства для отделочного текстильного производства Красители и химикаты для легкой промышленности"
"https://icatalog.expocentr.ru/ru/exhibitions/190a3ab4-1050-11f0-80ce-a0d3c1fab97f/exhibitors/381010?&stand=2C045";"ТЕКСМАШИМПОРТ, ООО";"http://www.texmashimport.ru/";"+7 (995) 540-3888";"texmashimport@mail.ru";"Швейные машины Вышивальные машины Раскройные установки (комплексы), машины и устройства, принадлежности Оборудование для настила ткани Челночные вышивальные машины Запчасти, комплектующие и техоснастка"
