Ссылка;Название;Сайт;Телефон;Email;Рубрики
"https://icatalog.expocentr.ru/ru/exhibitions/190a3ab4-1050-11f0-80ce-a0d3c1fab97f/exhibitors/381014?&stand=2C070";"ТЕКСТИЛЬ И ТЕХНОЛОГИИ, ООО";"http://www.t-textile.ru/";"+7 (499) 390-2885";"sale@t-textile.com";"Сопутствующие товары и услуги Оборудование для печати по текстилю Принтеры, плоттеры Термопрессы, каландры Красители и химикаты для легкой промышленности"
"https://icatalog.expocentr.ru/ru/exhibitions/190a3ab4-1050-11f0-80ce-a0d3c1fab97f/exhibitors/381586?&stand=2B038";"ТЕКСТИЛЬМАШ, ООО";"https://www.inlegmash-expo.ru/";"+7 8352 237150";"office@tmh21.ru";"Запчасти, комплектующие и техоснастка Сервисное обслуживание оборудования Оборудование и технологии для производства технического текстиля Бесчелночные ткацкие станки"
"https://icatalog.expocentr.ru/ru/exhibitions/190a3ab4-1050-11f0-80ce-a0d3c1fab97f/exhibitors/381273?&stand=2C070";"ТЕКСТЭЛЬ";"http://www.textelle.ru/";"+7 (495) 665-1545";"info@textelle.ru";"Технические ткани Текстиль с покрытием Ткани"
"https://icatalog.expocentr.ru/ru/exhibitions/190a3ab4-1050-11f0-80ce-a0d3c1fab97f/exhibitors/381009?&stand=2D050";"ТЕХНОПРИНТ, ООО";"https://tehno-print.com/";"+7 (931) 109-1534";"info@tehno-print.com";"Оборудование для печати по текстилю Принтеры, плоттеры Термопрессы, каландры Принтеры для печати по футболкам Комплексы для DTF-печати"
"https://icatalog.expocentr.ru/ru/exhibitions/190a3ab4-1050-11f0-80ce-a0d3c1fab97f/exhibitors/381015?&stand=2C040";"ТЛ ТЕКС, ООО";"http://www.tl-tex.ru/";"+7 (495) 980-0976";"project@tl-tex.ru";"Сушильно-ширильные машины Красильные машины и аппараты Оборудование для печати по текстилю Аппретирующее и отделочное оборудование Складальное и паковочное оборудование Красители и химикаты для легкой промышленности"
"https://icatalog.expocentr.ru/ru/exhibitions/190a3ab4-1050-11f0-80ce-a0d3c1fab97f/exhibitors/381035?&stand=2D010";"ТРАНСМЕТАЛЛ, ООО";"http://www.transmetall.ru/";"+7 4932 353030";"info@transmetall.ru";"Промышленные швейные машины Оверлоки Вышивальные машины Раскройные установки (комплексы), машины и устройства, принадлежности Оборудование для влажно-тепловой обработки (ВТО) Программное обеспечение для организации производства, САПР (CAD/CAE/CAM), программы учета"
"https://icatalog.expocentr.ru/ru/exhibitions/190a3ab4-1050-11f0-80ce-a0d3c1fab97f/exhibitors/381060?&stand=2E041";"ТРИСТАР ИНЖИНИРИНГ, OOO";"http://www.perevalov.ru/";"+7 (495) 721-1772";"info@perevalov.ru";"Раскройные установки (комплексы), машины и устройства, принадлежности Оборудование для настила ткани"
"https://icatalog.expocentr.ru/ru/exhibitions/190a3ab4-1050-11f0-80ce-a0d3c1fab97f/exhibitors/381037?&stand=2A040";"ФАРСИДА, ООО";"https://farsida.ru/";"+7 (909) 364-9019, (902) 295-0700";"farsida_tlt@mail.ru";"Оборудование для первичной обработки натуральных волокон Запчасти, комплектующие и техоснастка Оборудование для переработки химических волокон Текстурирующие машины Прядильные машины Крутильные машины"
"https://icatalog.expocentr.ru/ru/exhibitions/190a3ab4-1050-11f0-80ce-a0d3c1fab97f/exhibitors/381031?&stand=2C010";"ЦБП-СЕРВИС, ООО";"http://www.xn--90a2at.xn--p1ai/";"+7 (812) 402-2505";"info@cbp-service.ru";"Оборудование для первичной обработки натуральных волокон Подготовительное и вспомогательное оборудование для изготовления плетельных и басонных изделий, а также для лентоткацкого производства Оборудование для производства нетканых материалов"
"https://icatalog.expocentr.ru/ru/exhibitions/190a3ab4-1050-11f0-80ce-a0d3c1fab97f/exhibitors/381012?&stand=2E050";"ШВЕЙАВТОМАТИКА";"http://www.sewautomatics.ru/";"+7 3517965180";"grani74@bk.ru";"Швейные машины Многоголовочные вышивальные машины Подготовительное оборудование для швейного производства, швейные автоматы, машины, устройства и принадлежности Оборудование упаковочно-маркировочное Переработка отходов в легкой промышленности"
"https://icatalog.expocentr.ru/ru/exhibitions/190a3ab4-1050-11f0-80ce-a0d3c1fab97f/exhibitors/381036?&stand=2D045";"ШВЕЙМАШ ФИРМА, ООО";"http://www.shveymash.ru/";"+7 (499) 309-9999";"info@shveymash.ru";"Швейные машины Оборудование для скорняжного производства Подготовительное оборудование для швейного производства, швейные автоматы, машины, устройства и принадлежности Раскройные установки (комплексы), машины и устройства, принадлежности Гладильные и стабилизирующие установки, машины, устройства и принадлежности Запчасти, комплектующие и техоснастка"
"https://icatalog.expocentr.ru/ru/exhibitions/190a3ab4-1050-11f0-80ce-a0d3c1fab97f/exhibitors/381066?&stand=2C115";"ШВЕЙНЫЙ УСПЕХ";"https://xn--b1agapaxpprxx4b.xn--p1ai/";"+7 (985) 748-8915";"Sewing.success@yandex.ru";"Вышивальные машины Многоголовочные вышивальные машины Прочие вышивальные машины"
"https://icatalog.expocentr.ru/ru/exhibitions/190a3ab4-1050-11f0-80ce-a0d3c1fab97f/exhibitors/381024?&stand=2D085";"ЭЛФОРТ";"https://www.elfort.ru/";"+7 (495) 925-6500";"post@elfort.ru";"Швейные машины Промышленные швейные машины Оверлоки Подготовительное оборудование для швейного производства, швейные автоматы, машины, устройства и принадлежности Раскройные установки (комплексы), машины и устройства, принадлежности Гладильные и стабилизирующие установки, машины, устройства и принадлежности"
"https://icatalog.expocentr.ru/ru/exhibitions/190a3ab4-1050-11f0-80ce-a0d3c1fab97f/exhibitors/381049?&stand=2F030";"ЯСНОПОЛЯНСКАЯ ФАБРИКА ТАРЫ И УПАКОВКИ, ООО";"http://www.tara-upakovka.ru/";"+7 4872502914";"kbf@tara-upakovka.ru";"Запчасти, комплектующие и техоснастка Нетканые материалы Композиты Оборудование упаковочно-маркировочное Вспомогательное оборудование, детали и материалы Сопутствующие товары и услуги"
